{
  "id": "enemy.green_slime",
  "kind": "enemy",
  "displayName": "Green Slime",
  "displayNameKey": "enemy.green_slime.name",
  "visualId": "visual.enemy_green_slime",
  "level": 1,
  "maxHealth": 20,
  "damage": 2,
  "defense": 0,
  "moveSpeed": 45,
  "aggroRadius": 128,
  "attackRange": 28,
  "attackCooldown": 1.4,
  "leashRadius": 256,
  "respawnDelay": 10,
  "abilityLoadout": [],
  "aiProfileId": "test.ai.melee",
  "xpReward": 10,
  "lootTableId": "loot.green_slime",
  "collisionProfileId": "collision.enemy_default",
  "tags": ["slime", "wildlife"],
  "loot": [
    {
      "itemId": "item.slime_gel",
      "quantity": 1,
      "guaranteed": true
    }
  ]
}
